{
  "id": "q42",
  "label": "Qual 42",
  "meta": "L · battery B04",
  "battery": "B04",
  "status": "parsed",
  "sourceFile": "logs/event/Q42.wpilog",
  "phases": [
    {
      "id": "AUTO",
      "start": 0,
      "end": 15
    },
    {
      "id": "TELEOP",
      "start": 15,
      "end": 130
    },
    {
      "id": "ENDGAME",
      "start": 130,
      "end": 150
    }
  ],
  "tracks": [
    {
      "name": "BATTERY",
      "signal": "/Flashpoint/power/batteryVoltage",
      "unit": "V",
      "range": [
        6,
        13
      ],
      "threshold": {
        "value": 6.75,
        "label": "BROWNOUT 6.75"
      },
      "dt": 0.5,
      "values": [
        9.29,
        9.16,
        8.7,
        8.74,
        9.09,
        9.25,
        9.07,
        9.65,
        10.24,
        10.19,
        9.88,
        10.11,
        9.91,
        10.25,
        10.44,
        10.42,
        10.37,
        10.52,
        10.56,
        10.25,
        10.27,
        10.25,
        10.07,
        9.41,
        9.24,
        9.31,
        9.32,
        9.32,
        9.03,
        8.96,
        8.97,
        9.25,
        9.71,
        10.66,
        10.52,
        10.42,
        10.37,
        10.18,
        9.94,
        9.94,
        10.02,
        10.19,
        10.24,
        10.18,
        10.12,
        10.16,
        9.8,
        9.82,
        8.79,
        9.02,
        9.1,
        9.16,
        9.23,
        9.26,
        9.06,
        9,
        8.88,
        9.52,
        10.44,
        10.5,
        10.42,
        10.59,
        10.48,
        10.34,
        10.2,
        10.07,
        10.14,
        10.39,
        10.5,
        10.49,
        10.4,
        10.43,
        10.32,
        8.61,
        8.5,
        8.75,
        8.84,
        9.04,
        9.11,
        9.18,
        8.82,
        8.84,
        9.06,
        9.66,
        9.91,
        9.98,
        10.07,
        10.12,
        10.27,
        10.36,
        10.35,
        9.95,
        10.09,
        10.12,
        10.31,
        10.42,
        10.33,
        10.34,
        9.16,
        8.81,
        9.02,
        8.76,
        8.89,
        8.99,
        9.18,
        9.18,
        9.26,
        9.08,
        10.13,
        9.89,
        9.59,
        9.85,
        9.92,
        9.95,
        10.01,
        10.08,
        10.02,
        9.78,
        9.6,
        9.57,
        9.76,
        9.95,
        10.1,
        9.56,
        8.94,
        9.08,
        8.85,
        8.83,
        8.79,
        8.76,
        8.86,
        9.16,
        9.12,
        10.26,
        10.26,
        10.12,
        9.93,
        9.79,
        9.96,
        10.23,
        10.26,
        10.24,
        10.27,
        10.05,
        9.92,
        9.69,
        9.74,
        9.68,
        9.5,
        8.94,
        8.83,
        8.79,
        8.73,
        8.5,
        8.4,
        8.54,
        8.63,
        8.44,
        9.93,
        9.96,
        9.93,
        10.12,
        9.88,
        9.85,
        9.79,
        10,
        10.21,
        10.22,
        10.28,
        10.18,
        10.1,
        10,
        9.77,
        9.17,
        8.81,
        8.97,
        8.87,
        8.78,
        8.66,
        8.91,
        8.73,
        8.38,
        8.36,
        8.92,
        9.62,
        10.02,
        9.99,
        9.94,
        9.8,
        9.66,
        9.42,
        9.47,
        9.71,
        6.07,
        5.94,
        6.06,
        9.97,
        9.93,
        9.43,
        8.71,
        8.56,
        8.71,
        9.02,
        8.97,
        8.99,
        8.86,
        8.89,
        8.7,
        8.92,
        9.8,
        9.84,
        9.99,
        10.12,
        10.08,
        10.11,
        10.04,
        9.91,
        9.51,
        9.46,
        9.61,
        9.79,
        9.94,
        9.85,
        9.84,
        8.54,
        8.4,
        8.38,
        8.17,
        8.25,
        8.48,
        8.77,
        8.58,
        8.67,
        9.11,
        9.79,
        9.7,
        9.66,
        9.83,
        9.93,
        10.08,
        10.05,
        9.95,
        9.92,
        9.7,
        9.62,
        9.56,
        9.87,
        9.94,
        10.02,
        8.89,
        8.59,
        8.84,
        8.48,
        8.05,
        8.22,
        8.41,
        8.52,
        8.75,
        8.96,
        9.63,
        9.91,
        11.4,
        11.43,
        11.4,
        10.75,
        10.8,
        10.66,
        10.9,
        10.82,
        10.72,
        10.76,
        10.77,
        10.69,
        10.86,
        10.75,
        10.73,
        10.84,
        10.68,
        10.72,
        10.81,
        10.81,
        10.79,
        10.64,
        10.79,
        10.69,
        10.74,
        10.76,
        10.82,
        10.77,
        10.74,
        10.69,
        10.75,
        10.85,
        10.67,
        11.32,
        11.39,
        11.41,
        11.35,
        11.36,
        11.28,
        11.42
      ]
    },
    {
      "name": "TOTAL CURRENT",
      "signal": "/Flashpoint/power/totalCurrent",
      "unit": "A",
      "range": [
        0,
        500
      ],
      "threshold": {
        "value": 400,
        "label": "400 A"
      },
      "dt": 0.5,
      "values": [
        310.26,
        321.85,
        363.24,
        359.32,
        327.49,
        312.07,
        328.72,
        275.45,
        221.48,
        226.31,
        254.31,
        233.15,
        251.1,
        219.99,
        202.08,
        204.19,
        207.98,
        194.42,
        190.82,
        218.35,
        216.79,
        217.78,
        233.77,
        293.92,
        309.08,
        302.49,
        301.66,
        301.57,
        327.61,
        333.55,
        332.42,
        307.04,
        264.58,
        177.95,
        190.29,
        198.96,
        203.2,
        220.71,
        242.44,
        242.32,
        234.23,
        219.26,
        213.83,
        219.45,
        224.53,
        220.59,
        253.38,
        251.22,
        344.71,
        323.39,
        316.12,
        310.14,
        303.21,
        300.81,
        318.69,
        323.77,
        334.3,
        276.49,
        192.21,
        186.98,
        193.27,
        178.23,
        187.84,
        199.86,
        212.33,
        224.25,
        217.95,
        195.09,
        184.44,
        184.8,
        193.19,
        190.28,
        199.68,
        355.41,
        364.57,
        341.91,
        333.28,
        314.96,
        308.54,
        302.35,
        334.77,
        332.73,
        312.18,
        257.4,
        234.83,
        228.27,
        219.19,
        214.64,
        200.55,
        192.83,
        193.48,
        229.59,
        216.77,
        213.39,
        195.9,
        185.62,
        194.07,
        192.7,
        299.46,
        331.22,
        312.04,
        334.88,
        323.08,
        314.07,
        295.95,
        296.56,
        288.36,
        304.34,
        209.41,
        231.11,
        258.11,
        233.94,
        227.23,
        224.09,
        218.21,
        212.17,
        217.54,
        238.41,
        254.9,
        257.91,
        239.55,
        222.52,
        208.88,
        257.75,
        313.28,
        300.57,
        321.31,
        322.94,
        325.99,
        328.44,
        319.4,
        292.44,
        295.59,
        191.68,
        190.93,
        203.96,
        221,
        233.21,
        217.56,
        193.31,
        190.31,
        191.39,
        188.72,
        208.49,
        219.9,
        240.37,
        235.5,
        241.53,
        257,
        308.36,
        317.41,
        321.59,
        326.61,
        347.33,
        355.86,
        343.16,
        334.97,
        351.55,
        215.95,
        213.3,
        215.77,
        198.22,
        219.64,
        221.78,
        227.12,
        207.54,
        188.51,
        187.87,
        181.86,
        190.71,
        197.55,
        206.33,
        227.61,
        281.91,
        314.23,
        299.43,
        308.43,
        316.38,
        327,
        304.05,
        320.33,
        351.16,
        353.12,
        301.73,
        238.53,
        201.95,
        203.8,
        208.63,
        220.72,
        233.26,
        254.9,
        250.51,
        228.53,
        449.51,
        461.75,
        450.37,
        203.19,
        206.94,
        252.25,
        317.36,
        330.56,
        316.96,
        288.85,
        293.15,
        290.65,
        302.95,
        299.96,
        316.53,
        295.93,
        216.45,
        212.45,
        198.62,
        186.18,
        189.72,
        186.65,
        192.62,
        204.1,
        240.8,
        245.06,
        231.03,
        214.72,
        200.98,
        208.26,
        209.52,
        327.61,
        339.67,
        341.06,
        359.79,
        353.14,
        331.34,
        304.82,
        322.07,
        313.92,
        273.77,
        211.44,
        219.46,
        222.8,
        207.13,
        198.04,
        183.56,
        186.41,
        195.62,
        197.5,
        217.75,
        224.3,
        229.82,
        201.7,
        194.54,
        186.97,
        289.59,
        317.1,
        293.91,
        325.93,
        365.5,
        349.45,
        331.97,
        321.48,
        301,
        281.3,
        220.64,
        194.54,
        58.92,
        55.58,
        58.32,
        117.6,
        112.71,
        124.7,
        102.81,
        109.82,
        118.9,
        114.67,
        113.61,
        121.3,
        105.35,
        114.95,
        117,
        106.16,
        121.12,
        116.92,
        108.59,
        108.58,
        110,
        122.84,
        109.71,
        117.97,
        113.73,
        111.32,
        105.93,
        110.21,
        112.93,
        117.1,
        111.08,
        101.46,
        118.2,
        59.01,
        52.36,
        49.97,
        55.02,
        54.49,
        61.14,